{
  "$schema": "http://json-schema.org/draft-07/schema#",
  "$id": "https://astrid.builtin-training/schemas/run-state.schema.json",
  "title": "RunState",
  "description": "Canonical run state for builtin.dataset_build. Includes ownership/version fields for stale-save detection.",
  "type": "object",
  "required": ["run_id", "writer_id", "state_version", "created_at", "updated_at", "status"],
  "additionalProperties": false,
  "properties": {
    "run_id": {
      "type": "string",
      "description": "UUID or content-hash identifier for this run."
    },
    "writer_id": {
      "type": "string",
      "description": "Owner/agent identifier. Used to detect cross-agent state conflicts."
    },
    "state_version": {
      "type": "integer",
      "minimum": 0,
      "description": "Monotonically increasing version. Incremented on every state write. Clients include base_state_version in save payloads for stale-save detection."
    },
    "writer_epoch": {
      "type": "string",
      "description": "Optional epoch or timestamp for cross-agent coordination. Allows agents to detect if another writer has taken ownership."
    },
    "created_at": {
      "type": "string",
      "format": "date-time",
      "description": "ISO 8601 timestamp when this run was created."
    },
    "updated_at": {
      "type": "string",
      "format": "date-time",
      "description": "ISO 8601 timestamp when this state was last modified."
    },
    "status": {
      "type": "string",
      "enum": ["initializing", "acquiring", "captioning", "filtering", "reviewing", "finalized", "failed"],
      "description": "Current phase of the dataset build pipeline."
    },
    "config_hash": {
      "type": "string",
      "description": "SHA-256 of the config used for this run. Allows detection of config changes between resumes."
    },
    "schema_version_source": {
      "type": "string",
      "description": "Package-local parser provenance for configs that omitted schema_version.",
      "enum": ["deprecated_inferred_v1"]
    },
    "buckets": {
      "type": "object",
      "description": "Per-bucket state. Keyed by bucket name.",
      "additionalProperties": {
        "type": "object",
        "required": ["target_count", "accepted", "rejected", "pending"],
        "additionalProperties": false,
        "properties": {
          "target_count": {"type": "integer", "minimum": 0},
          "accepted": {"type": "integer", "minimum": 0},
          "rejected": {"type": "integer", "minimum": 0},
          "pending": {"type": "integer", "minimum": 0},
          "item_ids": {
            "type": "array",
            "items": {"type": "string"},
            "description": "Item IDs assigned to this bucket."
          }
        }
      }
    },
    "processed_source_ids": {
      "type": "array",
      "items": {"type": "string"},
      "description": "Source IDs that have been fully processed (acquired + extracted). Used for resume to avoid re-downloading."
    },
    "review_decisions": {
      "type": "object",
      "description": "Review decisions keyed by item_id. Only items with an explicit accept/reject decision appear here.",
      "additionalProperties": {
        "$ref": "review-decision.schema.json"
      }
    },
    "filter_stats": {
      "type": "object",
      "description": "Aggregated filter statistics across all stages.",
      "additionalProperties": {
        "$ref": "filter-stats.schema.json"
      }
    },
    "top_up_rounds": {
      "type": "integer",
      "minimum": 0,
      "default": 0,
      "description": "Number of top-up rounds executed so far."
    },
    "submitted": {
      "type": "boolean",
      "default": false,
      "description": "Whether the final review /submit has been received."
    },
    "completed_at": {
      "type": "string",
      "format": "date-time",
      "description": "ISO 8601 timestamp when the run was completed or finalized."
    },
    "error": {
      "type": "object",
      "description": "Error information if status is 'failed'.",
      "properties": {
        "message": {"type": "string"},
        "stage": {"type": "string"},
        "timestamp": {"type": "string", "format": "date-time"}
      }
    }
  }
}
