{
  "buckets": {
    "establishing": {
      "accepted": 0,
      "item_ids": [],
      "pending": 0,
      "rejected": 0,
      "target_count": 2
    }
  },
  "completed_at": "2026-05-21T00:00:00Z",
  "config_hash": "<CONFIG_HASH>",
  "created_at": "2026-05-21T00:00:00Z",
  "filter_stats": {
    "bucket_judge_filter": {
      "duration_ms": 0.0,
      "items_in": 3,
      "items_passed": 2,
      "items_rejected": 1,
      "rejection_reasons": {
        "low_quality": 1
      },
      "stage_id": "bucket_judge_filter",
      "stage_order": 1,
      "warnings": []
    },
    "duration_filter": {
      "duration_ms": 0.0,
      "items_in": 3,
      "items_passed": 3,
      "items_rejected": 0,
      "rejection_reasons": {},
      "stage_id": "duration_filter",
      "stage_order": 0,
      "warnings": []
    }
  },
  "processed_source_ids": [
    "fixture_test_clip_01",
    "fixture_test_clip_02",
    "fixture_test_clip_03"
  ],
  "review_decisions": {
    "item_aaad37dfa8c5d42a": {
      "decision": "accept",
      "edited_caption": "A reviewer-edited green-frame fixture caption for export.",
      "item_id": "item_aaad37dfa8c5d42a",
      "reject_reason": null,
      "reviewed_at": "2026-05-21T00:00:00Z",
      "reviewer_id": "fixture",
      "state_version": 0
    },
    "item_c6e3d6b92824f535": {
      "decision": "accept",
      "edited_caption": null,
      "item_id": "item_c6e3d6b92824f535",
      "reject_reason": null,
      "reviewed_at": "2026-05-21T00:00:00Z",
      "reviewer_id": "fixture",
      "state_version": 0
    },
    "item_ea4e240dfc31e8a5": {
      "decision": "reject",
      "edited_caption": null,
      "item_id": "item_ea4e240dfc31e8a5",
      "reject_reason": "low_quality",
      "reviewed_at": "2026-05-21T00:00:00Z",
      "reviewer_id": "fixture",
      "state_version": 0
    }
  },
  "run_id": "builtin-training-fixture",
  "state_version": 11,
  "status": "finalized",
  "submitted": true,
  "top_up_rounds": 0,
  "updated_at": "2026-05-21T00:00:00Z",
  "writer_id": "builtin.dataset_build"
}
